{
  "schemaVersion": 1,
  "chart": "funnel",
  "theme": "glass",
  "render": {
    "width": 908,
    "padding": 24,
    "scale": 2
  },
  "data": {
    "id": "signup-funnel",
    "locale": "zh-CN",
    "eyebrow": "注册漏斗",
    "title": "从落地页到激活",
    "subtitle": "30 天同期群 · 48,200 位访客 → 8,700 人激活 · 合成示例数据",
    "stages": [
      {
        "name": "访问落地页",
        "value": 48200,
        "accent": 2
      },
      {
        "name": "开始注册",
        "value": 18795,
        "accent": 4
      },
      {
        "name": "完成邮箱验证",
        "value": 12640,
        "accent": 7
      },
      {
        "name": "完善资料",
        "value": 8930,
        "accent": 3
      },
      {
        "name": "完成激活",
        "value": 8700,
        "accent": 6
      }
    ],
    "dropReasons": [
      "流失 29,405 人",
      "流失 6,155 人",
      "流失 3,710 人",
      "流失 230 人"
    ],
    "footerLabel": "结论",
    "footer": "整体转化率 18%——48,200 位访客中 8,700 人完成激活。最大流失环节：落地页到开始注册，流失 29,405 人。"
  }
}
