{
  "schemaVersion": 1,
  "chart": "narrative",
  "theme": "warm",
  "render": {
    "width": 908,
    "padding": 24,
    "scale": 2
  },
  "data": {
    "id": "cafe-membership",
    "locale": "zh-CN",
    "eyebrow": "产品说明 · 会员小程序",
    "title": "会员小程序 2.0 改版",
    "subtitle": "让常客的每一杯都有回响。先给结论，再谈流程、影响面与验收标准。",
    "sections": [
      {
        "kind": "cards",
        "eyebrow": "结论先行",
        "title": "本次改版的六项决策",
        "emoji": "☕",
        "icon": "flag",
        "items": [
          {
            "no": "01 · R1",
            "title": "积分即星星",
            "text": "每消费 1 元累计 1 颗星，无门槛，永不过期。",
            "accent": 1
          },
          {
            "no": "02 · R2",
            "title": "三档会员",
            "text": "银星、金星、黑金三档，90 天累计自动升降。",
            "accent": 2
          },
          {
            "no": "03 · R3",
            "title": "扫码即核销",
            "text": "店员扫一次码完成积分与核销，离线也能记账。",
            "accent": 3
          },
          {
            "no": "04 · R4",
            "title": "储值有礼",
            "text": "充值 200 送 20，余额可退，见首页。",
            "accent": 4
          },
          {
            "no": "05 · R5",
            "title": "生日双倍星",
            "text": "生日当周的全部消费按双倍累计星星。",
            "accent": 5
          },
          {
            "no": "06 · R6",
            "title": "只看趋势",
            "text": "店长端只看销量趋势，不做顾客画像。",
            "accent": 6
          }
        ]
      },
      {
        "kind": "steps",
        "eyebrow": "顾客流程",
        "title": "一单怎么走完四步",
        "emoji": "⭐️",
        "icon": "trend-up",
        "items": [
          {
            "label": "点单",
            "text": "柜台或小程序下单。",
            "emoji": "☕️",
            "icon": "package"
          },
          {
            "label": "攒星",
            "text": "扫码后星星自动入账。",
            "emoji": "⭐️",
            "icon": "chart"
          },
          {
            "label": "升级",
            "text": "90 天达标自动升档。",
            "emoji": "📈",
            "icon": "trend-up"
          },
          {
            "label": "兑换",
            "text": "用星星换饮品与甜品。",
            "emoji": "🎁",
            "icon": "flag"
          }
        ]
      },
      {
        "kind": "table",
        "eyebrow": "影响面",
        "title": "对谁改变了什么",
        "emoji": "🧾",
        "icon": "chart",
        "columns": [
          "角色",
          "现状",
          "改版之后"
        ],
        "rows": [
          {
            "cells": [
              "顾客",
              "纸卡盖章，丢了就清零",
              "星星进小程序，永久可查"
            ]
          },
          {
            "cells": [
              "店员",
              "手工记章、月底对账",
              "一次扫码完成积分与核销"
            ]
          },
          {
            "cells": [
              "店长",
              "月底手工盘点会员",
              "端内看实时销量趋势"
            ]
          },
          {
            "cells": [
              "财务",
              "储值靠纸质台账",
              "余额与赠礼自动入账"
            ]
          }
        ]
      },
      {
        "kind": "callout",
        "eyebrow": "依赖项",
        "title": "风险与依赖",
        "tone": "warn",
        "emoji": "⚠️",
        "icon": "shield",
        "text": "纸质盖章卡须在 10 月底前换算入库，双轨运行两周。若换算延期，新规则顺延一周启动，门店活动不变。"
      },
      {
        "kind": "checklist",
        "eyebrow": "验收标准",
        "title": "完成的定义",
        "emoji": "✅",
        "icon": "check",
        "items": [
          {
            "ok": true,
            "text": "常客到店扫码一次，完成积分与核销"
          },
          {
            "ok": true,
            "text": "90 天累计的升降档自动生效，无需人工"
          },
          {
            "ok": true,
            "text": "断网时店员仍能记账，联网后自动补传"
          },
          {
            "ok": true,
            "text": "储值余额可按原路退回"
          }
        ]
      },
      {
        "kind": "checklist",
        "eyebrow": "边界",
        "title": "本次不做的事",
        "emoji": "🚫",
        "icon": "lock",
        "items": [
          {
            "ok": false,
            "text": "外卖与配送"
          },
          {
            "ok": false,
            "text": "社交动态与评论"
          },
          {
            "ok": false,
            "text": "跨店通用积分"
          },
          {
            "ok": false,
            "text": "广告位与联名推广"
          }
        ]
      }
    ],
    "footerLabel": "决策归属",
    "footer": "R1–R3 归产品，R4–R5 归门店运营，R6 归数据。R4 上线前须通过支付合规评审。文中名称与数字均为合成示例数据。"
  }
}
