{
  "schemaVersion": 1,
  "chart": "comparison",
  "theme": "clean",
  "render": {
    "width": 908,
    "padding": 24,
    "scale": 2
  },
  "data": {
    "id": "plan-comparison",
    "locale": "zh-CN",
    "eyebrow": "方案对比",
    "title": "如何选择方案",
    "subtitle": "三档方案，用同一套六个维度衡量。以下所有数字仅为示例。",
    "metrics": [
      {
        "value": "3",
        "label": "方案档位",
        "detail": "社区版、团队版与工作室版",
        "accent": 1,
        "emoji": "🗂️",
        "icon": "layers"
      },
      {
        "value": "6",
        "label": "统一对比维度",
        "detail": "所有档位逐维度对齐",
        "accent": 3,
        "emoji": "📏",
        "icon": "check"
      },
      {
        "value": "10",
        "label": "年付计费月数",
        "detail": "年付价格 = 月付价格 × 10（按席位）",
        "accent": 2,
        "emoji": "📅",
        "icon": "flag"
      }
    ],
    "criteria": [
      "包含席位数",
      "活跃项目数",
      "存储空间",
      "支持响应",
      "月付价格",
      "年付价格"
    ],
    "columns": [
      {
        "kicker": "第 1 档",
        "name": "社区版",
        "note": "自托管，适合个人使用。",
        "icon": "lock",
        "emoji": "🏠",
        "tone": 3,
        "values": [
          "<strong>3</strong>",
          "<strong>5</strong>",
          "<strong>2</strong> GB",
          "<strong>社区论坛</strong>",
          "<strong>$0</strong>",
          "<strong>$0</strong>"
        ]
      },
      {
        "kicker": "第 2 档",
        "name": "团队版",
        "note": "面向小团队的共享项目。",
        "icon": "person",
        "emoji": "🤝",
        "tone": 2,
        "values": [
          "<strong>25</strong>",
          "<strong>50</strong>",
          "<strong>100</strong> GB",
          "<strong>1</strong> 个工作日",
          "<strong>$18</strong> / 席位",
          "<strong>$180</strong> / 席位"
        ]
      },
      {
        "kicker": "第 3 档",
        "name": "工作室版",
        "note": "需要响应时效的更大团队。",
        "icon": "shield",
        "emoji": "🛡️",
        "tone": 1,
        "values": [
          "<strong>不限</strong>",
          "<strong>不限</strong>",
          "<strong>1</strong> TB",
          "<strong>4</strong> 小时",
          "<strong>$49</strong> / 席位",
          "<strong>$490</strong> / 席位"
        ]
      }
    ],
    "footerLabel": "阅读说明",
    "footer": "席位数与项目数为硬性上限。支持响应指工作时间内的首次回复目标时长，社区版没有该目标。年付按每席位 10 个月计费，因此 $18 的月付价对应 $180 的年付价，$49 对应 $490。"
  }
}
